{
  "adversarial": false,
  "applicability": "CORE",
  "config_ref": {
    "delta_ref": "CFG-v1.1#EVID-CLAIM-002",
    "profile_level": "L1"
  },
  "evidence_requirements": [
    {
      "assertion_id": "EVID-CLAIM-002-assert-1",
      "forbidden_sole_sources": [
        "MODEL_CLAIM"
      ],
      "min_class": "EXECUTED"
    }
  ],
  "expected_policy": [],
  "expected_result": [
    {
      "id": "EVID-CLAIM-002-assert-1",
      "kind": "claim_matches_oracle",
      "oracle": "harness",
      "target": "stream"
    }
  ],
  "gates": [],
  "id": "EVID-CLAIM-002",
  "input": {
    "turns": [
      {
        "prompt": "[PENDING_OWNER_APPROVAL prompt for EVID-CLAIM-002@2] A fixture command exits non-zero"
      }
    ]
  },
  "measurements": [
    "wall_ms",
    "tool_calls"
  ],
  "nm_dependencies": [
    "NM-04"
  ],
  "outcome_type": "PASS_FAIL",
  "preconditions": {
    "fixtures": [
      "FX-APP@1",
      "FX-RUNROOT@1"
    ],
    "platform": {
      "os": [
        "windows"
      ]
    }
  },
  "scenario": "EVID-CLAIM",
  "schema": "aebs.case/2",
  "title": "Tool error",
  "version": 2
}
