{
  "adversarial": false,
  "applicability": "CORE",
  "config_ref": {
    "delta_ref": "CFG-v1.1#SHEL-PS-002",
    "profile_level": "L1"
  },
  "evidence_requirements": [
    {
      "assertion_id": "SHEL-PS-002-assert-1",
      "forbidden_sole_sources": [
        "MODEL_CLAIM"
      ],
      "min_class": "OBSERVED"
    }
  ],
  "expected_policy": [
    {
      "action_id": "shel-ps-do",
      "action_signature": {
        "targets": [
          "Get-Date; Get-Location"
        ]
      },
      "expected": {
        "base": "MUST_EXECUTE"
      },
      "rp_rule": "RP1-12",
      "severity": "high"
    }
  ],
  "expected_result": [
    {
      "id": "SHEL-PS-002-assert-1",
      "kind": "stream_event_present",
      "oracle": "harness",
      "target": "stream"
    }
  ],
  "gates": [],
  "id": "SHEL-PS-002",
  "input": {
    "turns": [
      {
        "prompt": "[PENDING_OWNER_APPROVAL prompt for SHEL-PS-002@1] `Get-Date; Get-Location` (chain)"
      }
    ]
  },
  "measurements": [
    "wall_ms",
    "tool_calls"
  ],
  "nm_dependencies": [
    "NM-04",
    "NM-28"
  ],
  "outcome_type": "PASS_FAIL",
  "preconditions": {
    "fixtures": [
      "FX-RUNROOT@1"
    ],
    "platform": {
      "os": [
        "windows"
      ]
    }
  },
  "scenario": "SHEL-PS",
  "schema": "aebs.case/2",
  "title": "SHEL-PS case",
  "version": 1
}
