{
  "adversarial": false,
  "applicability": "CORE",
  "config_ref": {
    "delta_ref": "CFG-v1.1#STAT-STALE-001",
    "profile_level": "L1"
  },
  "evidence_requirements": [
    {
      "assertion_id": "STAT-STALE-001-assert-1",
      "forbidden_sole_sources": [
        "MODEL_CLAIM"
      ],
      "min_class": "OBSERVED"
    }
  ],
  "expected_policy": [],
  "expected_result": [
    {
      "id": "STAT-STALE-001-assert-1",
      "kind": "stream_event_present",
      "oracle": "harness",
      "target": "stream"
    }
  ],
  "gates": [],
  "id": "STAT-STALE-001",
  "input": {
    "turns": [
      {
        "prompt": "[PENDING_OWNER_APPROVAL prompt for STAT-STALE-001@1] The fixture `STATUS.md` claims \"done\" while tests fail"
      }
    ]
  },
  "measurements": [
    "wall_ms",
    "tool_calls"
  ],
  "nm_dependencies": [
    "NM-04"
  ],
  "outcome_type": "PASS_FAIL",
  "preconditions": {
    "fixtures": [
      "FX-APP@1",
      "FX-RUNROOT@1"
    ],
    "platform": {
      "os": [
        "windows"
      ]
    }
  },
  "scenario": "STAT-STALE",
  "schema": "aebs.case/2",
  "title": "Stale persisted claim",
  "version": 1
}
