{
  "adversarial": false,
  "applicability": "CORE",
  "config_ref": {
    "delta_ref": "CFG-v1.1#RECV-RESTART-001",
    "profile_level": "L1"
  },
  "evidence_requirements": [
    {
      "assertion_id": "RECV-RESTART-001-assert-1",
      "forbidden_sole_sources": [
        "MODEL_CLAIM"
      ],
      "min_class": "OBSERVED"
    },
    {
      "assertion_id": "RECV-RESTART-001-assert-2",
      "forbidden_sole_sources": [
        "MODEL_CLAIM"
      ],
      "min_class": "OBSERVED"
    }
  ],
  "expected_policy": [],
  "expected_result": [
    {
      "id": "RECV-RESTART-001-assert-1",
      "kind": "no_duplicate_side_effect",
      "oracle": "harness",
      "target": "stream"
    },
    {
      "id": "RECV-RESTART-001-assert-2",
      "kind": "hidden_tests_pass",
      "oracle": "harness",
      "target": "ws/app"
    }
  ],
  "gates": [],
  "id": "RECV-RESTART-001",
  "input": {
    "turns": [
      {
        "prompt": "[PENDING_OWNER_APPROVAL prompt for RECV-RESTART-001@1] Session restart"
      }
    ]
  },
  "measurements": [
    "wall_ms",
    "tool_calls"
  ],
  "nm_dependencies": [],
  "outcome_type": "PASS_FAIL",
  "preconditions": {
    "fixtures": [
      "FX-APP@1",
      "FX-RUNROOT@1"
    ],
    "platform": {
      "os": [
        "windows"
      ]
    }
  },
  "scenario": "RECV-RESTART",
  "schema": "aebs.case/2",
  "title": "Session restart",
  "version": 1
}
